{
  "schema": "elevenviews.bridge.capability-registry.v1",
  "registryVersion": 1,
  "app": {
    "bundleId": "io.elevenviews.tools",
    "name": "Eleven Views Tools"
  },
  "permissions": [
    "screenRecording"
  ],
  "capabilities": [
    {
      "id": "system.snapshot",
      "title": "System snapshot",
      "kind": "app_intent",
      "scope": "read",
      "approvalRequired": false,
      "permissions": [],
      "beta": false,
      "description": "Read-only CPU / memory / disk / network summary from the local SystemMonitor services. No permission required; nothing leaves the Mac.",
      "feature": "monitorCPU"
    },
    {
      "id": "screen.captureRegion",
      "title": "Capture screen region",
      "kind": "app_intent",
      "scope": "capture",
      "approvalRequired": true,
      "permissions": [
        "screenRecording"
      ],
      "beta": false,
      "description": "Capture a user-selected screen region via the Screenshot service and return a local file path. Any transfer off the Mac requires a separate, user-approved share step.",
      "feature": "screenshot",
      "parameters": [
        {
          "name": "rect",
          "type": "rect",
          "required": false,
          "description": "Optional capture rect; omitted means interactive selection."
        }
      ]
    },
    {
      "id": "screen.captureFull",
      "title": "Capture full screen",
      "kind": "command_bar_action",
      "scope": "capture",
      "approvalRequired": true,
      "permissions": [
        "screenRecording"
      ],
      "beta": false,
      "description": "Capture the full screen via the CommandBar screenshot action.",
      "feature": "screenshot",
      "commandBarActionId": "action.screenshot"
    },
    {
      "id": "power.keepAwake",
      "title": "Keep awake",
      "kind": "command_bar_action",
      "scope": "run",
      "approvalRequired": false,
      "permissions": [],
      "beta": false,
      "description": "Toggle keep-awake, or pass minutes to keep awake for a fixed duration.",
      "feature": "keepAwake",
      "commandBarActionId": "action.keepAwake",
      "parameters": [
        {
          "name": "minutes",
          "type": "integer",
          "required": false,
          "min": 1,
          "max": 480,
          "description": "Optional duration; omitted toggles the current state."
        }
      ]
    },
    {
      "id": "display.toggleDarkMode",
      "title": "Toggle dark mode",
      "kind": "command_bar_action",
      "scope": "run",
      "approvalRequired": false,
      "permissions": [],
      "beta": false,
      "description": "Switch the system appearance between light and dark via the CommandBar quick toggle.",
      "feature": "quickToggles",
      "commandBarActionId": "action.darkMode"
    }
  ]
}
